1476,23,LC,41382,B,"21,0",0,,"1,33618","0,45494","0,22453",AMARELA,PROVA AMARELA PPL,,"0,0",2017,"545,5081462860107",https://niedsonemanoel.com.br/enem/An%C3%A1lise%20de%20Itens/OrdenarPorTri/1.%20Itens%20BNI_/41382.png,"QUESTÃO 18

CÂNCER DE MAMA.
== VAMOS TOCAR
— NESTE ASSUNTO.

A PREVENÇÃO
COMEÇA COM A
CONSCIENTIZAÇÃO.

USE O LAÇO ROSA,

Veja, 0.42, 20 cut 2010 (ataptado)

Campanhas de conscientização para o diagnóstico
precoce do câncer de mama estão presentes no cotidiano
das brasileiras, possibilitando maiores chances de cura
para a paciente, em especial se a doença for detectada
precocemente. Pela análise dos recursos verbais e não
verbais dessa peça publicitária, constata-se que o cartaz

O promove o convencimento do público feminino,
porque associa as palavras “prevenção” e
“conscientização”

busca persuadir as mulheres brasileiras, valendo-se
do duplo sentido da palavra “tocar”

objetiva chamar a atenção para um assunto evitado
por mulheres mais velhas.

convence a mulher a se engajar na campanha e a
usar o laço rosa

mostra a seriedade do assunto, evitado por muitas
mulheres.

vo oo
","624,589204788208","870,1436519622803","61,23",0,1
3386,30,LC,111929,A,"22,0",0,,"2,15283","1,51639","0,20049",AMARELA,PROVA AMARELA REGULAR,,"0,0",2022,"651,6282558441162",https://niedsonemanoel.com.br/enem/An%C3%A1lise%20de%20Itens/OrdenarPorTri/1.%20Itens%20BNI_/111929.png,"QUESTÃO 30

TEXTO |
EI.

Pa NE LEVE PARA SUA CASA!

14º FEIRA DE ADOÇÃO

ND DE CÃES E GATOS

4 EB

DOCUMENTOS OBRIGATÓRIOS PARA ADOL

CARTERADE DENTORDE | Cir | conPRowaNtE DE Rei

Disponível em ps;amigodobichovordprese com Acesso em: 10 dez. 2017.
TEXTO
Nas ruas, na cidade e no parque

Ninguém nunca prendeu o Delegado. O vaivém de rua
em rua e sua longa vida são relembrados e recontados.
Exemplo de sobrevivência, liderança, inteligência canina,
desde pequenininho seu focinho negro e seus olhos
delineados desenharam um mapa mental olfativo-visual de
Lavras. Corria de quem precisava correr e se aproximava
de quem não lhe faria mal, distinguia este daquele. Assim,
tomou-se um cão comunitário. Nunca se soube por que
escolheu a rua, talvez lhe tenham feito mal dentro de quatro
paredes. Idoso, teve câncer e desapareceu. O querido foi
procurado pela cidade inteira por duas protetoras, mas
nunca encontrado.

COSTA A. RM. Viver o amor aos cães: Parque Francisco de has.
Gama do Cachoeira: ri, 2014 (adaptado

Os dois textos abordam a temática de animais de rua,
porém, em relação ao Texto |, o Texto Il
O problematiza a necessidade de adoção de animais

sem lar

O valida a troca afetiva entre os pets adotados e seus
donos

O reforça a importância da campanha de adoção de
animais.

O exalta à natureza amigável de cães e de gatos.

6 promove a campanha de adoção de animais.
","702,6331424713135","854,5725345611572","60,02",0,1
1395,13,LC,44273,E,"23,0",0,,"0,76939","0,2678","0,01939",AMARELA,PROVA AMARELA REGULAR,,"0,0",2017,"526,782751083374",https://niedsonemanoel.com.br/enem/An%C3%A1lise%20de%20Itens/OrdenarPorTri/1.%20Itens%20BNI_/44273.png,"QUESTÃO 08

Sítio Gerimum

Este é o meu lugar [..]

Meu Gerimum é com g

Você pode ter estranhado

Gerimum em abundância

Aqui era plantado

Ecomaletrag

Meu lugar foi registrado.

OLIVEIRA HD. Lingua Portuguesa, n. 88, fe 201 ragmento

Nos versos de um menino de 12 anos, o emprego da
palavra “Gerimum” grafada com a letra “g” tem por objetivo
O valorizar usos informais caracterizadores da norma
nacional
confirmar o uso da norma-padrão em contexto da
linguagem poética
enfatizar um processo recorrente na transformação
da língua portuguesa.
registrar a diversidade étnica e linguística presente no
temitório brasileiro.
reafirmar discursivamente a forte relação do falante
com seu lugar de origem

o oo
","703,772783279419","1121,4511394500732","50,97",0,1
3180,42,LC,118073,C,"24,0",0,,"1,68791","0,79504","0,13105",AMARELA,PROVA AMARELA REGULAR,,,2021,"579,4970989227295",https://niedsonemanoel.com.br/enem/An%C3%A1lise%20de%20Itens/OrdenarPorTri/1.%20Itens%20BNI_/118073.png,"Questão 42

O documentário O menino que fez um museu,
direção de Sérgio Utsch, produção independente de
brasileiros e britânicos, gravado no Nordeste em 2016,
mais precisamente no distrito Dom Quintino, zona rural
do Crato, foi premiado em Londres, pela Foreign Press
Association (FPA), a associação de correspondentes
estrangeiros mais antiga do mundo, fundada em 1888.

De acordo com o diretor, O menino que fez um museu
foi o único trabalho produzido por equipes fora do eixo
Estados Unidos-Europa entre os finalistas. O documentário
conta a história de um Brasil profundo, desconhecido
até mesmo por muitos brasileiros. É apresentado com o
carisma de Pedro Lucas Feitosa, 11 anos.

Quando tinha 10 anos, Pedro Lucas criou o Museu
de Luiz Gonzaga, que fica no distrito de Dom Quintino.
A ideia surgiu após uma visita que o garoto fez, em
2013, quando tinha 8 anos, ao Museu do Gonzagão,
em Exu, Pernambuco. Pedro decidiu criar o próprio
lugar de exposição para homenagear o rei e o local
escolhido foi a casa da sua bisavó já falecida, que fica
ao lado da casa dele, na rua Alto de Antena.
Deperiel em wing comi Acesso em: ta 2018.
No segundo parágrafo, uma citação afirma que o
documentário “foi o único trabalho produzido por equipes
fora do eixo Estados Unidos-Europa entre os finalistas”.
No texto, esse recurso expressa uma estratégia
argumentativa que reforça a
OO originalidade da iniciativa de homenagem à vida e à
obra de Luiz Gonzaga.
O falta de concorrentes ao prêmio de uma das
associações mais antigas do mundo.
O proeza da premiação de uma história ambientada no
interior do Nordeste brasileiro.
O escassez de investimentos para a produção
cinematográfica independente no país.
O importância da parceria entre brasileiros e britânicos
para a realização das filmagens.
","651,0345935821533","843,3287143707275","56,55",0,1
3225,37,LC,119736,B,"25,0",0,,"1,23603","0,56456","0,2089",AMARELA,PROVA AMARELA PPL,,,2021,"556,4754009246826",https://niedsonemanoel.com.br/enem/An%C3%A1lise%20de%20Itens/OrdenarPorTri/1.%20Itens%20BNI_/119736.png,"Questão 37
Bola na rede

Futebol de várzea, pelada, baba, racha, rachão.
Os nomes podem ser diferentes em cada pedaço do Brasil,
mas bater uma bolinha é mesmo uma paixão nacional.
Os dados do suplemento de esporte da PNAD 2015
mostraram que o futebol foi a principal modalidade
esportiva praticada no Brasil, com 15,3 milhões de
adeptos.

É claro que o fato de o nosso pais ter um futebol
profissional consagrado, com times que arrebatam
torcidas e revelam jogadores, é uma influência positiva,
mas a maioria dessa galera que gosta de correr atrás
da bola não tem nenhuma pretensão profissional com o
esporte. Para eles, tão bom quanto marcar um gol é juntar
velhos amigos, fazer novas amizades e se divertir muito.

BENEDICTO Mi; MARULM Reto a evita do GE, 2 ao 201 (ga

Ao abordar a temática do futebol no Brasil, o texto

apresenta diferentes nomes para uma partida do esporte.
Ao fazer isso, fica evidente que

O ostorcedores enaltecem seus times favoritos.
o futebol é um esporte presente em todo o Brasil.
a linguagem do futebol reaproxima pessoas distantes.

os campeonatos da modalidade propiciam a integração
do Brasi.

as regiões do país imprimem um estilo próprio para o
jogo de futebol.

o
c]
o
o
","644,1299915313721","909,0464115142822","60,45",0,1
2458,39,LC,18128,A,"26,0",0,,"2,46437","1,68698","0,1109",AMARELA,PROVA AMARELA REGULAR,,"0,0",2020,"668,689489364624",https://niedsonemanoel.com.br/enem/An%C3%A1lise%20de%20Itens/OrdenarPorTri/1.%20Itens%20BNI_/18128.png,"Questão 39 no 7
Policarpo Quaresma, cidadão brasileiro, funcionário
público, certo de que a língua portuguesa é emprestada
ao Brasil; certo também de que, por esse fato, o
falar e o escrever em geral, sobretudo no campo das
letras, se veem na humilhante contingência de sofrer
continuamente censuras ásperas dos proprietários da
língua; sabendo, além, que, dentro do nosso país, os
autores e os escritores, com especialidade os gramáticos,
não se entendem no tocante à correção gramatical,
vendo-se, diariamente, surgir azedas polêmicas entre os.
mais profundos estudiosos do nosso idioma — usando
do direito que lhe confere a Constituição, vem pedir que
o Congresso Nacional decrete o tupi-guarani como língua
oficial e nacional do povo brasileiro.
BARRETO, Tt fm do Policarpo Quareama.
Depeil em mendorsiopáic gore emo em: 26 2012
Nessa petição da pitoresca personagem do romance de
Lima Barreto, o uso da norma-padrão justifica-se pela

O situação social de enunciação representada.
O divergência teórica entre gramáticos e literatos.
O pouca representatividade das linguas indígenas.
(O atitude irônica diante da lingua dos colonizadores.
GQ tentativa de solicitação do documento demandado.

","718,895673751831","850,3382205963135","55,54",0,1
1686,6,LC,112092,B,"27,0",0,,"2,40823","1,41052","0,06055",Amarela,PROVA AMARELA REGULAR,,"0,0",2018,"641,0567760467529",https://niedsonemanoel.com.br/enem/An%C3%A1lise%20de%20Itens/OrdenarPorTri/1.%20Itens%20BNI_/112092.png,"QUESTÃO 06

Ó Pátria amada,

Idolatrada,

Salve! Salvel

Brasil, de amor etemo seja simbolo

O lábaro que ostentas estrelado,

E diga o verde-louro dessa flâmula
—*Paz no futuro e glória no passado.”
Mas, se ergues da justiça a clava forte,
Verás que um filho teu não foge à luta,
Nem teme, quem te adora, a própria morte.
Terra adorada,

Entre outras mil,

Éstu, Brasil,

O Pátria amada!

Dos filhos deste solo és mãe gentil,
Pátria amada, Brasill

is aciona jon ao epi Ora Prq

O uso da norma-padrão na letra do Hino Nacional do
Brasil é justificado por tratar-se de um(a)

vovo

reverência de um povo a seu país.
género solene de caracteristica protocolar.

canção concebida sem interferência da oralidade.
escrita de uma fase mais antiga da língua portuguesa.
artefato cultural respeitado por todo o povo brasileiro.
","695,3494548797607","829,2405605316162","53,03",0,1
2476,38,LC,24606,A,"28,0",0,,"2,59817","2,54956","0,25858",AMARELA,PROVA AMARELA PPL,,"0,0",2020,"754,9588680267334",https://niedsonemanoel.com.br/enem/An%C3%A1lise%20de%20Itens/OrdenarPorTri/1.%20Itens%20BNI_/24606.png,"Questão 38 Cn enem onenemonon

Hoje, críticas e frustrações dos clientes encontram
um canal imediato nas redes, que funcionam como
amplificadoras de rápido alcance. O monitoramento
constante de tudo que é publicado sobre determinada
marca é vital para reagir rapidamente em situações que
podem ser prejudiciais à imagem corporativa.

Uma possibilidade é recorrer a agências que oferecem
serviços especializados de estratégias de comunicação.
Como esses serviços custam caro, é comum as pequenas
e médias empresas apostarem em times intemos para
realizar o monitoramento.

Os especialistas alertam: não transforme as redes
sociais em um serviço de atendimento ao consumidor.
“Sempre que possível, tire a conversa do espaço público.
Se uma reclamação surgir em sua página, responda
rapidamente, lamentando o ocorrido. Em seguida,
peça e-mail e telefone de contato e resolva a questão
diretamente com o consumidor. Esse tipo de atividade faz
“com que essa mesma pessoa volte à intemet, mas agora
para falar bem da empresa.

DNIT E: RIBEIRO, A Como ant uma ba eutação eo?
Pequenas Empresas Grandes Hegôios 1240 mais nz

As novas tecnologias têm alterado a dinâmica entre
empresas e consumidores. Essa nova ordem do mercado
tem efeitos benéficos para a sociedade, como a
construção de relações sociais mais responsáveis.
(O garantia das informações propiciadas pelas redes sociais.
O promoção de relações mercadológicas pautadas em
interesses pessoais.
o
e

o

propagação de relações interpessoais mediadas por
interesses de mercado.

divulgação de informações para atingir a reputação
de empresas.
","793,2870388031006","920,163869857788","62,93",0,1
1443,19,LC,23784,A,"29,0",0,,"1,04729","1,07423","0,25133",AMARELA,PROVA AMARELA REGULAR,,"0,0",2017,"607,4397563934326",https://niedsonemanoel.com.br/enem/An%C3%A1lise%20de%20Itens/OrdenarPorTri/1.%20Itens%20BNI_/23784.png,"QUESTÃO 14

Mas assim que penetramos no universo da web,
descobrimos que ele constitui não apenas um imenso
“teritório” em expansão acelerada, mas que também
oferece inúmeros “mapas”, filtros, seleções para ajudar
o navegante a orientar-se. O melhor guia para a web é
a própria web. Ainda que seja preciso ter a paciência
de explorá-la. Ainda que seja preciso arriscar-se a ficar
perdido, aceitar “a perda de tempo” para familiarizar-se
com esta terra estranha. Talvez seja preciso ceder por um
instante a seu aspecto lúdico para descobrir, no desvio
de um link, os sites que mais se aproximam de nossos
interesses profissionais ou de nossas paixões e que
poderão, portanto, alimentar da melhor maneira possível
nossa jornada pessoal

LÉN, Cibercultura. São Pal: Era 3,106
O usuário iniciante sente-se não raramente desorientado
no oceano de informações e possibilidades disponíveis
na rede mundial de computadores. Nesse sentido,
Pierre Lévy destaca como um dos principais aspectos da
intemet o(a)

espaço aberto para a aprendizagem.
grande número de ferramentas de pesquisa.
ausência de mapas ou guias explicativos.
infinito número de páginas virtuais.
dificuldade de acesso aos sites de pesquisa.

voos
","703,784704208374","1018,2230472564696","62,57",0,1
1687,7,LC,27299,B,"30,0",0,,"2,01498","-0,46648","0,20636",Amarela,PROVA AMARELA PPL,,"0,0",2018,"453,3569812774658",https://niedsonemanoel.com.br/enem/An%C3%A1lise%20de%20Itens/OrdenarPorTri/1.%20Itens%20BNI_/27299.png,"Para que serve a tecnologia

Computador

“Com os computadores e a internet, mudei muito.
A Lian de hoje é totalmente diferente daqueia de
antes da informática. Me abriu portas a, além de tudo,
fui aceita por pessoas que achava que não iriam
me aceitar. Com a internet, viajei o mundo. Fui até
Portugal e à África. Eu nem sabia que lá a realidade
era tão forte. Perto deles, estamos até muto bem. —
Tânia “Lian” Siva, 26, india pankararu.

w

“Eu gosto muto de televisão. Assisto às novelas,
me vito muto. Mas, ao mesmo tempo, sei que squio
tudo que passa lá não é verdade. É tudo uma Ilusão
— Valentina Maria Vieira dos Santos, 89, india fulnto da
aldeia Xoga cla.
Mp3 Playor

“Cuida do meu tocador de MP3 como se fosse um
tesouro. É um pen drive simples, mas é muto especial
para mim. Nele ouço músicas indigenas e bandas da
própria aldeia. Ele vive emprestado porque acaba sendo
a diversão da aldeia inteira. Uso até para etbir uns videos.
que baixo da internet. Basta colocar no apareiho de DVD
com entrada USB que tenho. — Jailon Parkaranu, 23,
ndo pankararu.
Os depoimentos apresentados no texo retratam o
modo como diferentes. gerações indígenas relatam
suas experiências com os artefatos tecnológicos. Os
comentários reveiam

O uma preferência pela possblidade de uso do
computador.

O um elogio à utlidade da tecnologia no cotidiano
indígena

O uma clica à própria identiade antes da inclusão
diga,

O o gosto pela ilusão em tolenoveias transmitidas na TV.

O o desejo de possuir um aparemo importado.
","507,3444843292236","669,7981357574463","60,32",0,1
"(26.0, 316)",132,LC,16998,B,"26,0",0,,"2,99478","1,22235","0,18701",Cinza,PROVA CINZA REGULAR,,,2014,"622,2336292266846",https://niedsonemanoel.com.br/enem/An%C3%A1lise%20de%20Itens/OrdenarPorTri/1.%20Itens%20BNI_/16998.png,"QUESTÃO 132 === mm

eu acho um fato interessante... né... foi como meu
pai e minha mãe vieram se conhecer... né... que... minha
mãe morava no Piauí com toda família... né... meu... meu
avô... matemo no caso... era maquinista... ele sofreu um
acidente... infelizmente morreu... minha mãe tinha cinco
anos... né... e o irmão mais velho dela... meu padrinho.
tinha dezessete e ele foiobrigado a trabalhar... foi trabalhar
no banco... e... ele foi... o banco... no caso... estava.
com um número de funcionários cheio e ele teve que ir
para outro local e pediu transferência prum local mais
perto de Pamaíba que era a cidade onde eles moravam
e por engano o... o... escrivão entendeu Paraíba... né
e meu... e minha família veio parar em Mossoró que
era exatamente o local mais perto onde tinha vaga pra
funcionário do Banco do Brasil e:: ela foi parar na rua do
meu pai... né... e começaram a se conhecer... namoraram
onze anos... né... pararam algum tempo... brigaram... é
lógico... porque todo relacionamento tem uma briga... né.
e eu achei esse fato muito interessante porque foi uma
coincidência incrível... né... como vieram a se conhecer.
namoraram e hoje... e até hoje estão juntos... dezessete
anos de casados.
CUNHA MA E (09). Corpus discurso & gramática agua fada e
“seria na dade do Natal Nata EGUP RI 068
Na transcrição de fala, há um breve relato de experiência
pessoal, no qual se observa a frequente repetição de “né”
Essa repetição é um(a)
indice de baixa escolaridade do falante.
estratégia típica de manutenção da interação oral
marca de conexão lógica entre conteúdos na fala
manifestação característica da fala regional nordestina.

voo o

recurso enfatizador da informação mais relevante da
narrativa.
","659,6343517303467","768,6822414398193","59,35",0,1
"(29.0, 3231)",43,LC,120649,A,"29,0",0,,"2,24442","0,51708","0,11092",AMARELA,PROVA AMARELA PPL,,,2021,"551,7165660858154",https://niedsonemanoel.com.br/enem/An%C3%A1lise%20de%20Itens/OrdenarPorTri/1.%20Itens%20BNI_/120649.png,"Questão 43

Seja por meio de uma conversa, uma mensagem
de texto ou uma fotografia, a interação em sociedade
acontece por meio da comunicação, e isso não é diferente.
na intemet. Como colaborar para a inclusão digital de
outros usuários para uma intemet mais livre, aberta e, de
fato, comunicativa?

Os termos “acesso”, “usabilidade” e “inclusão digitar
“sempre acabam aparecendo em conjunto em discussões
sobre como a sociedade se comunica pela intemet.
Ter um computador com acesso à intemet é, como
primeiro passo, essencial — mas saber utilizá-lo e
conseguir, de fato, se comunicar, acessar a informação
disponível na intemet e usá-la é uma questão de caráter
social muito mais profunda e diversa.

Estar conectado é, acima de tudo, estabelecer
“comunicação com o outro — o qual pode viver em
contextos sociais, econômicos e até mesmo físicos
totalmente diferentes dos nossos. Ao levarmos em conta
a intemet como um ambiente que refete e traz novas
possibilidades à sociedade offline — se é que podemos
fazer essa distinção —, é indispensável considerar,
na infraestrutura, na linguagem e nos conteúdos que
circulam em rede, todas as diferenças presentes em
nossa sociedade.

Pensar em inclusão digital, como já dito,
é pensar sempre no lugar do outro na interação e
“comunicação. Nem sempre a forma como costumamos
escrever posts, criar imagens ou publicar vídeos é a mais
adequada para que aquilo que elaboramos seja, de fato,
acessível a todos. Reconhecer que nossa perspectiva é
diferente da perspectiva do outro é imprescindível para
que pensemos, incluindo todos esses outros, em novas
formas de criar que levem em consideração diversas
realidades de uso na internet.

Deh epa comdr. eso em mao 2010 pad

No contexto das tecnologias de informação e

“comunicação, o texto amplia o conceito de inclusão
digital ao

O vincular a utilização da linguagem e do conteúdo ao
reconhecimento do intertocutor.

O ressaltar a importância do acesso aos aparelhos
tecnológicos.

O destacar a infraestrutura da intemet como
imprescindível.

o

e

descrever o aspecto multimídia das mensagens
virtuais.

comparar a vida virtual on-line com a vida real off-line.
","606,8246364593506","751,1489391326904","55,55",0,1
"(15.0, 285)",101,LC,17316,D,"15,0",0,,"2,20141","2,37224","0,1478",Cinza,PROVA CINZA REGULAR,,,2014,"737,2229099273682",https://niedsonemanoel.com.br/enem/An%C3%A1lise%20de%20Itens/OrdenarPorTri/1.%20Itens%20BNI_/17316.png,"QUESTÃO 101 === gym

Psicologia de um vencido

Eu, filho do carbono e do amoníaco,
Monstro de escuridão e rutilância,
Sofro, desde a epigênesis da infância,
A influência má dos signos do zodíaco.

Profundissimamente hipocondriaco,

Este ambiente me causa repugnância.
Sobe-me à boca uma ânsia análoga à ânsia
Que se escapa da boca de um cardíaco.

Já o verme — este operário das ruínas —
Que o sangue podre das camificinas
Come, e à vida em geral declara guerra,

Anda a espreitar meus olhos para roê-los,
E há de deixar-me apenas os cabelos,
Na frialdade inorgânica da terral

ANJOS, A. Obra completa. Rio de Janio: Nova Aguiar 1004.

A poesia de Augusto dos Anjos revela aspectos de uma
literatura de transição designada como pré-modemista.
Com relação à poética e à abordagem temática presentes
no soneto, identificam-se marcas dessa literatura de
transição como

O a forma do soneto, os versos metrificados, a
presença de rimas e o vocabulário requintado, além
do ceticismo, que antecipam conceitos estéticos
vigentes no Modernismo.

O o empenho do eu lírico pelo resgate da poesia
simbolista, manifesta em metáforas como “Monstro
de escuridão e rutilância” e “influência má dos signos
do zodiaco”.

O a seleção lexical emprestada ao cientificismo, como
se lê em “carbono e amoníaco”, “epigênesis da
infância” e “frialdade inorgânica”, que restitui a visão
naturalista do homem.

O a manutenção de elementos formais vinculados
à estética do Pamasianismo e do Simbolismo,
dimensionada pela inovação na expressividade
poética, e o desconcerto existencial

O a ênfase no processo de construção de uma poesia
descritiva e ao mesmo tempo filosófica, que incorpora
valores morais e científicos mais tarde renovados
pelos modernistas.
","790,9195423126221","938,615083694458","57,39",0,1
"(11.0, 715)",100,LC,27233,C,"11,0",0,,"3,09291","0,6999","0,19055",Cinza,PROVA CINZA PPL,,"0,0",2015,"569,9937343597412",https://niedsonemanoel.com.br/enem/An%C3%A1lise%20de%20Itens/OrdenarPorTri/1.%20Itens%20BNI_/27233.png,"QUESTÃO 100

A dança modema propõe em primeiro lugar o
conhecimento de si e o autodomínio. Minha proposta é
esta: através do conhecimento e do autodomínio chego à
forma, à minha forma — e não o contrário. É uma inversão
que muda toda a estética, toda a razão do movimento.
Atécnica na dança tem apenas uma finalidade: preparar
o corpo para responder à exigência do espírito artístico.

VIANA CARVALHO. 4. A nça, São Pao: sta, 100
Na abordagem dos autores, a técnica, o autodomínio e o
conhecimento do bailarino estão a serviço da
O padronização do movimento da dança.
O subordinação do corpo a um padrão.
O concretização da criação pessoal
O ideia preconcebida de forma
OQ busca pela igualdade entre os bailarinos.
","606,0163974761963","711,6477489471436","59,53",0,1
"(12.0, 1580)",36,LC,46834,C,"12,0",0,,"3,93945","0,91634","0,15994",AMARELA,PROVA AMARELA PPL,,"0,0",2017,"591,637372970581",https://niedsonemanoel.com.br/enem/An%C3%A1lise%20de%20Itens/OrdenarPorTri/1.%20Itens%20BNI_/46834.png,"QUESTÃO 31

MÚKHINA, V. Operário e mulher kolkosiana.
Aço inoxidável, 24,5 m. Moscou, 1837.

Desponiel em:hpaptrdjur auto com Moss em: 7 maio 2012
Essa escultura foi produzida durante o período da ditadura
stalinista, na ex-União Soviética, e representa o(a)

O luta do proletariado soviético para sua emancipação
do sistema vigente

O trabalhador soviético retratado de acordo com a
realidade do período.

O exaltação idealizada da capacidade de trabalho do
povo soviético.

O união de operários e camponeses soviéticos pela
volta do regime czarista.

O sofrimento de trabalhadores soviéticos pela opressão
do regime stalinista.
","621,1631298065186","703,8037776947021","58,0",0,1
